{
  "$schema": "https://raw.githubusercontent.com/iwmaeda/revloop/main/schema/reviewer.schema.json",
  "displayName": "Codex",
  "trigger": "@codex review",
  "botLogin": "chatgpt-codex-connector[bot]",
  "cleanPatterns": ["^Codex Review: Didn't find any major issues\\."],
  "rateLimitPatterns": ["You have reached your Codex usage limits"],
  "severityLevels": ["P1", "P2", "P3"],
  "severityMap": { "P1": "critical", "P2": "high", "P3": "low" },
  "markerTolerated": "verified",
  "status": "verified"
}
