{
  "$schema": "https://raw.githubusercontent.com/iwmaeda/revloop/main/schema/reviewer.schema.json",
  "displayName": "Gemini Code Assist",
  "trigger": "@gemini review",
  "botLogin": "gemini-code-assist[bot]",
  "severityLevels": ["P1", "P2", "P3"],
  "severityMap": { "P1": "critical", "P2": "high", "P3": "low" },
  "status": "verified"
}
